{
  "catalogId": "legacy-sample-smoke-catalog",
  "entries": [
    {
      "claimLevel": "public-safe",
      "displayName": "Large public dotnet client",
      "families": [
        {
          "expectation": "required",
          "expectedCoverageLabels": [
            "AnalysisGap",
            "Reduced"
          ],
          "expectedEvidenceTiers": [
            "Tier4Unknown"
          ],
          "expectedRuleIds": [
            "build.environment.workspace-diagnostic.v1",
            "legacy.flow.gap-propagation.v1"
          ],
          "extractorGapCodes": [
            "extractor-reduced-coverage"
          ],
          "familyId": "analysis-gap-reporting",
          "limitations": [
            {
              "code": "gap-is-not-absence",
              "message": "Analysis gaps preserve reduced coverage without claiming absence."
            }
          ],
          "statesAllowed": [
            "analysis-gap",
            "reduced",
            "truncated"
          ]
        },
        {
          "expectation": "required",
          "expectedCoverageLabels": [
            "Reduced",
            "SyntaxFallback"
          ],
          "expectedEvidenceTiers": [
            "Tier3SyntaxOrTextual",
            "Tier4Unknown"
          ],
          "expectedExtractors": [
            "csharp.syntax"
          ],
          "expectedRuleIds": [
            "csharp.syntax.declarations.v1",
            "csharp.syntax.invocation.v1"
          ],
          "familyId": "fallback-syntax-scan",
          "limitations": [
            {
              "code": "syntax-fallback-review-tier",
              "message": "Syntax fallback remains review-tier evidence and is not upgraded to semantic proof."
            }
          ],
          "statesAllowed": [
            "analysis-gap",
            "observed",
            "reduced"
          ]
        },
        {
          "artifactSizeBucket": "extra-large",
          "expectation": "exploratory",
          "expectedCoverageLabels": [
            "Reduced",
            "Truncated"
          ],
          "expectedEvidenceTiers": [
            "Tier4Unknown"
          ],
          "expectedRuleIds": [
            "legacy.validation.bounds.v1",
            "legacy.validation.summary.v1"
          ],
          "extractorGapCodes": [
            "extractor-reduced-coverage"
          ],
          "familyId": "large-repo-stress",
          "limitations": [
            {
              "code": "bounded-stress-only",
              "message": "Stress expectations use timeout and artifact-size buckets without raw file lists or identifying counts."
            }
          ],
          "statesAllowed": [
            "analysis-gap",
            "observed",
            "reduced",
            "truncated"
          ],
          "timeoutBucket": "extra-large"
        }
      ],
      "limitations": [
        {
          "code": "catalog-not-raw-output",
          "message": "This entry records expected smoke coverage only; raw artifacts stay out of tracked catalog files."
        }
      ],
      "relationships": [
        {
          "artifactKind": "redacted-validation-summary",
          "claimLevel": "public-safe",
          "safeArtifactId": "large-public-dotnet-client-summary",
          "schemaVersion": "legacy-codebase-validation-summary.v1",
          "spec": "legacy-codebase-validation",
          "validationStatus": "observed"
        },
        {
          "artifactKind": "evidence-pack-summary",
          "claimLevel": "public-safe",
          "safeArtifactId": "large-public-dotnet-client-pack",
          "schemaVersion": "legacy-sample-evidence-pack-summary.v1",
          "spec": "legacy-sample-evidence-pack",
          "validationStatus": "observed"
        }
      ],
      "sampleLabel": "large-public-dotnet-client",
      "source": {
        "classification": "synthetic-fixture",
        "commitIdentity": {
          "kind": "fixture-version",
          "limitations": [],
          "shaPresent": false,
          "value": "large-dotnet-client-fixture@2026-06"
        },
        "identityKind": "neutral-label",
        "reviewed": true,
        "safeSourceAlias": "tracemap-fixture"
      },
      "validation": {
        "commandTemplates": [
          {
            "artifactSizeBucket": "small",
            "expectedArtifacts": [
              "evidence-pack-reference",
              "redacted-summary"
            ],
            "mode": "redacted-artifact-only",
            "name": "create-evidence-pack",
            "template": "tracemap evidence-pack create --input <redacted-summary> --input-kind legacy-validation-summary --label <sample-label> --claim-level <claim-level> --date <YYYY-MM> --out <pack-output>",
            "timeoutBucket": "small"
          },
          {
            "artifactSizeBucket": "extra-large",
            "expectedArtifacts": [
              "analyzer-log-present",
              "facts-ndjson-present",
              "index-sqlite-present",
              "report-md-present",
              "scan-manifest"
            ],
            "mode": "checked-in-sample",
            "name": "scan-sample",
            "template": "tracemap scan --repo <sample-root> --out <scan-output>",
            "timeoutBucket": "extra-large"
          }
        ],
        "gates": [
          "./scripts/check-private-paths.sh",
          "catalog validate",
          "git diff --check"
        ]
      }
    },
    {
      "claimLevel": "public-safe",
      "displayName": "Legacy build diagnostics synthetic",
      "families": [
        {
          "expectation": "required",
          "expectedCoverageLabels": [
            "AnalysisGap",
            "Reduced"
          ],
          "expectedEvidenceTiers": [
            "Tier4Unknown"
          ],
          "expectedRuleIds": [
            "build.environment.workspace-diagnostic.v1",
            "legacy.flow.gap-propagation.v1"
          ],
          "extractorGapCodes": [
            "extractor-reduced-coverage"
          ],
          "familyId": "analysis-gap-reporting",
          "limitations": [
            {
              "code": "gap-is-not-absence",
              "message": "Analysis gaps preserve reduced coverage without claiming absence."
            }
          ],
          "statesAllowed": [
            "analysis-gap",
            "reduced"
          ]
        },
        {
          "expectation": "optional",
          "expectedCoverageLabels": [
            "AnalysisGap",
            "Reduced"
          ],
          "expectedEvidenceTiers": [
            "Tier2Structural",
            "Tier4Unknown"
          ],
          "expectedExtractors": [
            "xml.config"
          ],
          "expectedRuleIds": [
            "build.environment.project-format.v1",
            "legacy.validation.environment.v1"
          ],
          "familyId": "binding-redirects",
          "limitations": [
            {
              "code": "binding-redirect-shape-only",
              "message": "Binding redirect expectations use shape and count buckets only."
            }
          ],
          "statesAllowed": [
            "analysis-gap",
            "observed"
          ]
        },
        {
          "expectation": "required",
          "expectedCoverageLabels": [
            "AnalysisGap",
            "Reduced"
          ],
          "expectedEvidenceTiers": [
            "Tier2Structural",
            "Tier4Unknown"
          ],
          "expectedExtractors": [
            "project.file",
            "xml.config"
          ],
          "expectedRuleIds": [
            "build.environment.project-format.v1",
            "build.environment.restore.v1",
            "build.environment.toolset.v1"
          ],
          "familyId": "build-environment-diagnostics",
          "limitations": [
            {
              "code": "environment-static-only",
              "message": "Environment diagnostics are static project and config indicators."
            }
          ],
          "statesAllowed": [
            "analysis-gap",
            "observed",
            "reduced"
          ]
        },
        {
          "expectation": "required",
          "expectedCoverageLabels": [
            "AnalysisGap",
            "Reduced"
          ],
          "expectedEvidenceTiers": [
            "Tier4Unknown"
          ],
          "expectedRuleIds": [
            "build.environment.workspace-diagnostic.v1",
            "csharp.semantic.workspace.v1"
          ],
          "extractorGapCodes": [
            "extractor-reduced-coverage"
          ],
          "familyId": "msbuild-project-load-failure",
          "limitations": [
            {
              "code": "failed-build-reduced-coverage",
              "message": "Failed project load is reduced coverage and is not treated as clean analysis."
            }
          ],
          "statesAllowed": [
            "analysis-gap",
            "reduced"
          ]
        },
        {
          "expectation": "optional",
          "expectedCoverageLabels": [
            "AnalysisGap",
            "Reduced"
          ],
          "expectedEvidenceTiers": [
            "Tier2Structural",
            "Tier4Unknown"
          ],
          "expectedExtractors": [
            "project.file"
          ],
          "expectedRuleIds": [
            "build.environment.restore.v1",
            "project.file.v1"
          ],
          "familyId": "packages-config",
          "limitations": [
            {
              "code": "package-shape-only",
              "message": "Package metadata is a static declaration and not a restore result."
            }
          ],
          "statesAllowed": [
            "analysis-gap",
            "observed"
          ]
        }
      ],
      "limitations": [
        {
          "code": "catalog-not-raw-output",
          "message": "This entry records expected smoke coverage only; raw artifacts stay out of tracked catalog files."
        }